<?xml version="1.0" encoding="windows-1251"?>
<!DOCTYPE chapter SYSTEM "./core.dtd">
<chapter name="Компиляция во внутренний код (ocamlopt)" number="11">
  <abstract>
    <para>
      В этой главе описывается высокопроизводительный компилятор
      внутреннего кода Objective Caml <command>ocamlopt</command>,
      который компилирует исходные тексты Caml в объектные файлы с
      внутренним кодом и компонует последние в самостоятельные
      исполняемые файлы.</para>
    <para>Этот компилятор доступен не на всех платформах. Генерируемый
      им код работает быстрее байткода, создаваемого
      <command>ocamlc</command>, однако возрастает как время
      компиляции, так и размер исполняемых файлов. Тем не менее,
      совместимость с байткодом исключительно выскока: один и тот же
      код работает одинаково вне зависимости от того, скомпилирован он
      <command>ocamlc</command> или
      <command>ocamlopt</command>.</para>
    <para>Файлы с внутренним кодом нельзя смешивать с файлами с
      байкодом: программа должна быть скомилирована целиком либо
      <command>ocamlc</command>, либо <command>ocamlopt</command>.
      Объектные файлы с внутренним кодом, кроме того, не могут
      загружаться в интерактивную систему
      <command>ocaml</command>.</para>
  </abstract>
  <main-matters>
    <section name="Обзор компилятора">
      <para><command>ocamlopt</command> имеет интерфейс командной
	строки, весьма схожий с <command>ocamlc</command>. Компилятор
	принимает те же типы аргументов: </para>
      
    </section>
  </main-matters>
</chapter>