<?xml version="1.0" encoding="utf-8"?>
<!DOCTYPE chapter SYSTEM "core.dtd">
<chapter name="Генератор документации (ocamldoc)" number="15">
  <abstract>
    <para>В этой главе описывается OCamldoc, средство для генерации
      документации из специальных комментариев в исходном тексте
      программ. Такие комментарии записываются в форме <keyword>(**
	... *)</keyword> в соотвествии с форматом, опсианным в разделе
      15.2.</para>
    <para>OCamldoc может генерировать документацию в форматах HTML,
      LaTeX, TeXinfo, страниц руководства Unix и графов зависимостей
      <command>dot</command>. Кроме того, как объясняется в разлеле
      15.3, можно создавать собственные генераторы.</para>
    <para>В этой главе слово <emph>элемент</emph> может означать следующие части исходного текста OCaml: объявление типа, значение, модуль, исключение, </para>
  </abstract>
  <main-matters>
    <section>
    </section>
  </main-matters>
</chapter>
